{
  "session_id": "203",
  "verbatim_quote": {
    "original": "می‌خوام خودت رو قضاوت کنی؛ سیستمی که برات الان طراحی کردم خودت می‌خوام اون رو قضاوت کنی. مثلاً یک تسک از نو شروع کن، تسک قضاوت‌کردن خودت و پرسوناهای داخل سیستم پرامپت. باید اول برنامه‌ریزی کنی براش با برین آرکیتکچر، برین استورمینگ باید بکنی، باید توسط اسکیل بلوش داخل اینترنت جست‌وجو کنی، نواقص رو پیدا کنی، بعد این فلو و این استیت ماشین رو خودت بری جلو، هندل کنی اتوپایلت فعال، با اتوپایلت.",
    "english_translation": "Judge yourself: the system I designed for you — judge it. Start a fresh task, a self-judgment task on yourself and the system-prompt personas. First plan it with Brain architecture, brainstorm, search the internet via the blowsh skill, find the flaws, then walk the flow and state machine yourself on active autopilot."
  },
  "extracted_decision": {
    "summary": "Manager orders recurring-style self-judgment runs: fresh task, Brain Architect planning + brainstorm + blowsh web research, then full autopilot QA/reviewer loop with zero questions.",
    "category": "process",
    "rationale": "Manager wants the system to find its own flaws against external evidence instead of waiting for him to spot them.",
    "alternatives": [
      "Manager files flaw reports himself",
      "No self-review; fix on failure only"
    ],
    "tradeoffs": "Turns spent per run in exchange for self-found improvements (this run: W3/W4 fixes + W2 proposal)."
  },
  "project_name": "cognitive-lead-hq",
  "redaction_verified": true,
  "decision_id": "DEC-20260912-010",
  "timestamp": "2026-09-12T10:09:17.605761+00:00"
}
